{
  "total_duration_sec": 30,
  "target_persona": "girly",
  "emotional_arc": "curiosity→empathy→solution→desire→action",
  "beats": [
    {
      "id": 1,
      "function": "hook",
      "duration_ratio": 0.08,
      "energy": "high",
      "description": "트러블 피부 공감 질문으로 시선 고정"
    },
    {
      "id": 2,
      "function": "empathy",
      "duration_ratio": 0.20,
      "energy": "medium",
      "description": "나도 그랬어 — 실제 경험 공유로 신뢰 구축"
    },
    {
      "id": 3,
      "function": "tip",
      "duration_ratio": 0.37,
      "energy": "medium",
      "description": "진정 스킨케어 3단계 핵심 루틴 공개"
    },
    {
      "id": 4,
      "function": "product_focus",
      "duration_ratio": 0.20,
      "energy": "medium",
      "description": "요즘 쓰는 제품 자연스럽게 소개"
    },
    {
      "id": 5,
      "function": "cta",
      "duration_ratio": 0.15,
      "energy": "high",
      "description": "저장·팔로우 직접 요청"
    }
  ]
}
